{"schema_version":"1.0","contract_version":"1.0.0","benchmark_id":"opace_synthetic_mechanics","benchmark_version":"0.1.0","purpose":"Prove BENCH-10 deterministic offline mechanics without a product comparison or public claim.","observation_window":{"starts_at":"2026-08-26T12:00:00.000Z","ends_at":"2026-08-26T12:00:00.000Z"},"frozen_at":"2026-08-26T12:00:00.000Z","corpus_manifest":{"path":"corpus.json","sha256":"sha256:d724bcce8e6b1d1c9aca54d54e155fe62f8bf37c0067aa72b51b10c98ee7136f"},"method_manifest":{"path":"methods.json","sha256":"sha256:9fd1e7259a0b44fe31184e4258f83817ba2ee27e1f8218ac5ac1e53d22f24da3"},"environment_manifest":{"path":"environment.json","sha256":"sha256:a606148ff2d29a373eb173cdef1c6341bdc724e5c1bb7aa4061524d1e11ad10d"},"pre_registration":{"path":"pre-registration.json","sha256":"sha256:5ce342a01caf7d3f848b07c2a6c75271751680bb42b76d7032e5877e5c7fd1f3"},"split_policy":{"tuning":true,"evaluation":true,"held_out_minimum_per_cell":20},"runner_version":"0.1.0","scorer_version":"0.1.0","correction_policy":"new_patch_identity_only","fixed_seed":20260826}
